step_number,description,requirements,typical_timeline
1,SFMTA staff develop a fare-policy proposal and accompanying operating-funding scenario.,"Internal analysis of fare impact, replacement revenue, equity goals, and implementation design.",Weeks to months before formal budget/board action
2,SFMTA Board of Directors reviews and approves the fare-policy direction or budget package containing fare changes.,"Board hearings, public comment, staff recommendation, and political support inside agency governance.",Board budget cycle; concentrated in spring of even-numbered budget years
3,A recurring funding source (or stack of sources) is identified and advanced.,"Could include local ballot measure, regional ballot measure, city budget support, state grants, or a targeted pilot funding stack.",Months to year-plus depending on whether ballot approval is needed
4,Mayor forwards/negotiates the budget and related funding plan through the city budget process.,Executive support or at minimum executive tolerance; alignment with broader city fiscal priorities.,Spring to early summer budget process
5,"Board of Supervisors accepts, modifies through surrounding fiscal politics, or rejects the budget package; override politics matter if the Mayor objects to appropriations.","Committee hearings, coalition building, and enough votes for adoption/override where relevant.",Late spring to summer budget hearings
6,"SFMTA operations implement the program: fare media rules, customer communication, operator guidance, enforcement adjustments, and monitoring.","Operational readiness, public communications, Clipper/fare-system adjustments where needed, and performance monitoring.",Weeks to months after funding and policy approval
