date,description,type,impact_on_viability,stakeholders_affected,action_enabled,time_sensitivity
2021-08-15,Free Muni for all youth launches/expands as a universal program for riders age 18 and under on regular Muni service.,policy,positive,Youth riders; schools; SFMTA; youth advocates,Provides a concrete local precedent for broader fare-free arguments,Long-run precedent; always relevant
2025-06-21,Summer 2025 Muni service cuts take effect as part of balancing a near-term budget gap.,fiscal,negative,Daily riders; operators; SFMTA leadership; supervisors,Raises urgency for new revenue and strengthens protect-service messaging,High in debates about service-first objections
2025-07-15,Controller's Office publishes the Muni Funding Working Group final recommendations.,institutional,positive,Mayor's Office; Board of Supervisors; SFMTA; advocates,Gives campaigns an official menu of options and evidence of package-based thinking,Medium; especially useful during 2026 revenue debates
2026-02-19,"Governor signs legislation authorizing a $590 million Bay Area transit emergency loan covering Muni, BART, Caltrain, and AC Transit.",external,positive,MTC; Governor/CalSTA; SFMTA; regional agencies,Prevents immediate collapse and buys time for long-term revenue strategy,High but temporary
2026-02-25,SFMTA publishes budget open-house/community-input update highlighting major public concern about service cuts and noting more than $160 million in savings/efficiencies already achieved.,sentiment,positive,Riders; SFMTA; elected officials,Supports a narrative that the agency has already pursued self-help and needs new revenue,High during budget messaging
2026-02-26,"SFCTA publicly details the three-pronged strategy: regional measure, local parcel tax, and agency self-help strategies.",policy,positive,SFCTA; SFMTA; Mayor; BOS; property owners; regional partners,Clarifies the realistic funding stack for any future access expansion,Very high leading into November 2026
2026-04-21,SFMTA Board budget hearing on FY26-27/FY27-28 budget and proposed fare/fee changes.,institutional,neutral,SFMTA Board; agency staff; rider advocates; media,"Formal venue for record-building, testimony, and policy positioning",Very high immediately before board action
2026-07-01,FY26-27 begins; official structural deficit period starts if no full solution is in place.,fiscal,negative,All Muni riders and city budget actors,Creates strongest near-term pressure for bridge solutions or service tradeoffs,Critical deadline
2026-11-03,Potential November 2026 ballot window for the regional sales tax measure and local Muni parcel tax.,electoral,positive,Voters; Mayor; BOS; SFCTA; MTC; advocacy coalitions,Only major near-term path to large recurring revenue at required scale,Critical campaign window
2030-07-01,Projected structural deficit rises to roughly $434 million absent durable long-term solutions.,fiscal,negative,SFMTA; city budget actors; riders; labor,Strengthens long-run argument that bridge fixes are insufficient,Long horizon but strategically important
